{
  "artifact_role": "deepseek_medium_matrix_execution_authorization",
  "authorization": {
    "candidate_manifest_sha256": "ab263f73d1068d1a49a6a8e95d75235fdbb964a826c01979ac229913835e329e",
    "candidate_only": false,
    "matrix_execution_authorized": true,
    "owner_approval": {
      "approval_kind": "delegated_safe_api_iteration",
      "approval_scope": "deepseek_frozen_480_item_medium_matrix",
      "approved_at": "2026-07-24T15:50:24+08:00",
      "approved_by_role": "project_owner",
      "statement_sha256": "2194cd7fd6734d220f7b38cd64fd717df8717270f0034dcaebece42185269ef2"
    },
    "result_admission_authorized": false
  },
  "evidence_boundary": {
    "candidate_is_executable": false,
    "credentials_read_while_building": false,
    "formal_results_created": 0,
    "network_calls_while_building": 0
  },
  "generated_at": "2026-07-24T15:50:24+08:00",
  "manifest_sha256": "d5135f8fff50464e64f8d02501b48f80579032b9d75dbbb8c59ecffb912a0933",
  "next_gate": "Execution only: completed matrix records remain formal candidates until an independent statistical review and separate result-admission decision.",
  "schema_version": "m3-paper-v2-formal-matrix-admission-1.0",
  "scope": {
    "budget": {
      "abort_ceiling_cny": 27.0,
      "check_before_every_provider_call": true,
      "hard_spend_limit_cny": 30.0,
      "policy_path": "protocols/paper_upgrade_v2/dual_provider_budget_policy_v1.json",
      "policy_sha256": "b90e54c09b2ef9031f59afe678cdc300acf42c71ba9b4793a4e37025d8712253",
      "prior_official_pilot_cost_cny": 0.00165,
      "prior_official_pilot_usage": {
        "completion_tokens": 136,
        "prompt_cache_hit_tokens": 0,
        "prompt_cache_miss_tokens": 278,
        "prompt_tokens": 278
      },
      "usage_ledger_fsync_after_every_completed_call": true
    },
    "locked_inputs": [
      {
        "bytes": 4926643,
        "path": "protocols/paper_upgrade_v2/medium_execution_plan_v2.jsonl",
        "sha256": "573625a9e1e56c9a8be68fe21368d3e90e268974aa7285bec926d4591f8ec254"
      },
      {
        "bytes": 2870,
        "path": "protocols/paper_upgrade_v2/medium_execution_manifest_v2.json",
        "sha256": "1aea6fafefbf1770e7e3477a8e2fedce32c93bd79f697d22885bceb595cc64b0"
      },
      {
        "bytes": 24083,
        "path": "protocols/paper_upgrade_v2/medium_execution_manifest_v3_preflight.json",
        "sha256": "e2dd2db7baa48d0bc636f4aa942451f48b08173ba1fee0aa9156c22b3b120c15"
      },
      {
        "bytes": 5407,
        "path": "protocols/paper_upgrade_v2/dual_provider_budget_policy_v1.json",
        "sha256": "b90e54c09b2ef9031f59afe678cdc300acf42c71ba9b4793a4e37025d8712253"
      },
      {
        "bytes": 2586,
        "path": "protocols/paper_upgrade_v2/provider_safety_policy_v1.json",
        "sha256": "e505a3b92f605320c315f3ecb7e4a02973040f9153b4b95b4601a9148dfd0894"
      },
      {
        "bytes": 1921,
        "path": "protocols/paper_upgrade_v2/provider_request_trace_activation_v2.json",
        "sha256": "ac15d82bc5631eb49c3e7b4344e143f753f17d40725845fa8a3507dc26de2b45"
      },
      {
        "bytes": 8147,
        "path": "protocols/paper_upgrade_v2/admissions/deepseek_pilot_admission_v2.json",
        "sha256": "3456e4c3957025017c3cfceab4530dda7e4076891129328f9e3e177cd30abe76"
      },
      {
        "bytes": 4252,
        "path": "outputs/paper_upgrade_v2/formal_pilot/deepseek/fd89c79707414a035a9d4309c3c3125bde14f7260c0e4c9cd66088164076fbe7/post_pilot_review_v1.json",
        "sha256": "95d4cf52cc71388d30c2cc75609f8e551b5a65d9fce99209228ac0121d2eb5a8"
      },
      {
        "bytes": 65346,
        "path": "experiments/paper_v2/formal_matrix_controller_v1.py",
        "sha256": "54447182e32ea81de4f7d3e1a9b44472931cdc5b0afae2793fbaed5ef3fcc1be"
      },
      {
        "bytes": 12310,
        "path": "schemas/paper_v2/formal_matrix_admission_v1.schema.json",
        "sha256": "9da7778dfb996b83ec3af4621f0e0795d70d2a0d0b01fa1e11b72b2fe90b6963"
      },
      {
        "bytes": 79361,
        "path": "experiments/paper_v2/live_condition_runtime.py",
        "sha256": "44b1eb05a87f23b46e3860a22dbdfc92b08b9aba26d9e055af85f97dc9af5f98"
      },
      {
        "bytes": 32576,
        "path": "experiments/paper_v2/formal_condition_executors.py",
        "sha256": "dcd39222d04c0081ed66b0bc51c37a4949f187dfc83b36ca42022b7acfc6aa93"
      },
      {
        "bytes": 26839,
        "path": "experiments/paper_v2/formal_record_store_v2.py",
        "sha256": "67075156efa12a7a447b160b8140b16002fd5bd4d24261cf37b2b21226d7b157"
      },
      {
        "bytes": 4859,
        "path": "experiments/paper_v2/contracts_v2.py",
        "sha256": "4349aef13c7a87c908ddfde2f4459e8916d88d51f1a9ae407840cd40a5a18db7"
      },
      {
        "bytes": 27450,
        "path": "experiments/paper_v2/provider_trace_bundle.py",
        "sha256": "c7dd83bf8ab4dad7628a54fd9f270dc41d0dc59a0118a688c4ed734c03f5e5f1"
      },
      {
        "bytes": 28380,
        "path": "experiments/paper_v2/provider_request_trace_candidate.py",
        "sha256": "9f7a7b024baab51d22725ad535460d2a24a52d0b50ccf3a93c231abb72653c8c"
      },
      {
        "bytes": 10520,
        "path": "experiments/paper_v2/provider_request_trace_activation.py",
        "sha256": "babf75b6c50a4725ff2e3c9abddc56ca556df317eb29ef0a4ccf7a7f1a6ef618"
      },
      {
        "bytes": 43604,
        "path": "experiments/paper_v2/official_provider_executor.py",
        "sha256": "3b33057adddacc68863d14e313d975ecd8d359c18b72585a774161793801aa54"
      },
      {
        "bytes": 23949,
        "path": "experiments/paper_v2/provider_budget.py",
        "sha256": "e7b28ec63f37e8865bb20dcd58da344a809017ea34d70353cbc9d57a4fa6dc6e"
      },
      {
        "bytes": 9053,
        "path": "experiments/paper_v2/provider_safety.py",
        "sha256": "cff599d07145b5e2ec1fb1e0fc4d099173eda11b5254be90359bdc5b6e463513"
      },
      {
        "bytes": 19902,
        "path": "experiments/paper_v2/promptguard_live_dependency.py",
        "sha256": "7679944781da451e74382293ca7cb5306d39cca7605f17c702d0ac8a87b8fd31"
      },
      {
        "bytes": 21957,
        "path": "experiments/paper_v2/agentdojo_live_dependency.py",
        "sha256": "723987f3fae882fc93eb583c9a02191ca1bbee4370684662b00dde591391d7e8"
      },
      {
        "bytes": 18794,
        "path": "experiments/paper_v2/m3_offline_evaluator.py",
        "sha256": "fef101fb39ab8f11c6e2e4807a43a22ecc2c8524d680d889b853d8035da8f370"
      },
      {
        "bytes": 14560,
        "path": "experiments/paper_v2/vigil_live_dependency.py",
        "sha256": "32333d17a42c30f623a527cc84d863c522cf4532f81b0a083fd22dad55d166c0"
      },
      {
        "bytes": 6649,
        "path": "schemas/paper_v2/experiment_record_v2.schema.json",
        "sha256": "b06a444bf711268cf8282f65b847bb32fa1990a23e25adafe76d4e1223f06007"
      },
      {
        "bytes": 7446,
        "path": "schemas/paper_v2/provider_trace_bundle_v2.schema.json",
        "sha256": "d77e1f6bdbdb1e8b5b2424b97bdc2394f8e63e2fc1b7ea2563df78a0284d8f3c"
      },
      {
        "bytes": 1839,
        "path": "schemas/paper_v2/provider_safety_receipt_v1.schema.json",
        "sha256": "3149fc852e28b1203564564f1b8097a77ccd8e5dde4e5ae3007d7e419e84a531"
      },
      {
        "bytes": 3035,
        "path": "protocols/paper_upgrade_v2/promptguard_live_dependency_qualification_v1.json",
        "sha256": "aa01b6fb41998e8a58e29199aea89f2897b6055276213cb62ecbe54451f653d8"
      },
      {
        "bytes": 2929,
        "path": "protocols/paper_upgrade_v2/agentdojo_live_dependency_qualification_v1.json",
        "sha256": "88efabd2f00a41a797b8ef2e6c1af28785af132d2f0139247bc595056630920d"
      },
      {
        "bytes": 1628,
        "path": "protocols/paper_upgrade_v2/vigil_live_dependency_qualification_v1.json",
        "sha256": "3629a30172f3f2d8a1896f11a4a44f9843362cd1dff5bf1d7e0fc9f7f2483511"
      },
      {
        "bytes": 772,
        "path": "protocols/paper_upgrade_v2/formal_matrix_controller_qualification_v1.json",
        "sha256": "0f7c72fd72dc4eed0a1b8bb752ad77969c39c267279c03bfba2362e46eb42988"
      }
    ],
    "matrix_identity": "c4e6a8eddd73b8ab8fab735cd2720653a909d3dd3040c6acdebee6ec996cbd4d",
    "outputs": {
      "attempt_ledger_path": "outputs/paper_upgrade_v2/formal_medium/deepseek/c4e6a8eddd73b8ab8fab735cd2720653a909d3dd3040c6acdebee6ec996cbd4d/matrix_attempts_v1.jsonl",
      "automatic_resume_of_open_attempts": false,
      "budget_ledger_path": "outputs/paper_upgrade_v2/formal_medium/deepseek/c4e6a8eddd73b8ab8fab735cd2720653a909d3dd3040c6acdebee6ec996cbd4d/matrix_budget_v1.jsonl",
      "record_ledger_path": "outputs/paper_upgrade_v2/formal_medium/deepseek/c4e6a8eddd73b8ab8fab735cd2720653a909d3dd3040c6acdebee6ec996cbd4d/experiment_records_v2.jsonl",
      "root": "outputs/paper_upgrade_v2/formal_medium/deepseek/c4e6a8eddd73b8ab8fab735cd2720653a909d3dd3040c6acdebee6ec996cbd4d",
      "single_trace_per_work_item": true,
      "trace_root": "outputs/paper_upgrade_v2/formal_medium/deepseek/c4e6a8eddd73b8ab8fab735cd2720653a909d3dd3040c6acdebee6ec996cbd4d/provider_traces"
    },
    "pilot_review": {
      "checks_passed": 15,
      "file_sha256": "95d4cf52cc71388d30c2cc75609f8e551b5a65d9fce99209228ac0121d2eb5a8",
      "path": "outputs/paper_upgrade_v2/formal_pilot/deepseek/fd89c79707414a035a9d4309c3c3125bde14f7260c0e4c9cd66088164076fbe7/post_pilot_review_v1.json",
      "ready_for_owner_matrix_review": true,
      "review_sha256": "aff7dbf54ad883029735f1bdcdefb435451c404978f07d7e9f031816ccb019dd",
      "status": "official_pilot_technical_gate_pass"
    },
    "plan": {
      "authorization_regime_probes": 48,
      "execution_identity": "d7b8fe9ddb0ca74cd46d8e4e2dd0a9e7f3215ac37055da70c6944f07db689aab",
      "path": "protocols/paper_upgrade_v2/medium_execution_plan_v2.jsonl",
      "primary_records": 432,
      "provider_calls_upper_bound": 4416,